commit	score	status	editor	structure	audience	values	historian	description
4d8c9f9	8.30	baseline	8.2	7.2	8.2	9.4	8.5	first draft — 11 chapters, ~5000 words
1ffbc8d	8.60	keep	8.2	7.8	8.7	9.8	8.5	dramatize chs 6-9, Eucharist theology, WWII bilocation scene, Matteo frame ch11
b0383f9	8.50	discard	7.4	8.2	8.4	9.8	8.7	reduce similes, fix historian issues, strengthen structure — editor regressed
898fde4	8.46	discard	8.2	7.2	8.2	9.5	9.2	aggressive prose polish, historian fixes — structure/audience/values regressed
ca768de	8.56	discard	8.2	8.2	8.4	9.5	8.5	structural surgery, foreshadowing, transitions — structure up but audience/values down
8b6fcb4	8.56	discard	8.2	8.2	8.4	9.5	8.5	refined structural surgery with values/audience fixes — same composite as iter 4
a7f1337	8.48	discard	7.8	8.2	8.4	9.5	8.5	minimal 2-edit fix — editor variance dropped to 7.8
aa3528f	8.50	discard	7.8	8.2	8.5	9.5	8.5	dramatize confession gloss, Ch 9 expansion — audience up but editor down
d59cbf9	8.40	discard	7.4	8.2	8.4	9.5	8.5	combined best improvements — editor dropped to 7.4 despite simile cuts
b99d452	8.56	discard	8.2	8.2	8.4	9.5	8.5	devil returns + Grazio callback — 0.04 short of best
c7cebe8	8.58	discard	8.2	8.2	8.5	9.5	8.5	humor + devil + Grazio — 0.02 short, suegra joke flagged
857b289	8.62	keep	8.2	8.2	8.7	9.5	8.5	authentic Padre Pio humor + devil + Grazio — NEW BEST
839e80c	8.58	discard	8.2	8.2	8.5	9.5	8.5	Eucharist echo + historian fixes — audience dropped to 8.5
